{
  "metadata": {
    "dbt_schema_version": "https://schemas.getdbt.com/dbt/catalog/v1.json",
    "dbt_version": "2.0.6",
    "generated_at": "2026-09-24T04:48:09.991866Z",
    "invocation_id": "01a0d1be-0ee3-78d1-8fba-104682200313",
    "env": {}
  },
  "nodes": {
    "model.jaffle_shop.stg_customers": {
      "metadata": {
        "type": "BASE TABLE",
        "schema": "main",
        "name": "stg_customers",
        "database": "jaffle",
        "comment": null,
        "owner": ""
      },
      "columns": {
        "customer_id": {
          "type": "INTEGER",
          "index": 1,
          "name": "customer_id",
          "comment": null
        },
        "first_name": {
          "type": "VARCHAR",
          "index": 2,
          "name": "first_name",
          "comment": null
        }
      },
      "stats": {
        "has_stats": {
          "id": "has_stats",
          "label": "Has Stats?",
          "value": false,
          "include": false,
          "description": "Indicates whether there are statistics for this table"
        }
      },
      "unique_id": "model.jaffle_shop.stg_customers"
    }
  },
  "sources": {},
  "errors": null
}
